imgSrc,text
https://raw.githubusercontent.com/YunjungLeeHappy/AnnotationC/main/annotorious_github/assets/Tappytoon/Mturk/MyLife_4.jpg,this comic image was girl  she was going to school
https://raw.githubusercontent.com/YunjungLeeHappy/AnnotationC/main/annotorious_github/assets/Tappytoon/Mturk/Hourglass_2.jpg,Some girls argue about some things and feel like happy.
https://raw.githubusercontent.com/YunjungLeeHappy/AnnotationC/main/annotorious_github/assets/Tappytoon/Mturk/Hourglass_3.jpg,this comic image was start being her eyes out soon
https://raw.githubusercontent.com/YunjungLeeHappy/AnnotationC/main/annotorious_github/assets/Tappytoon/Mturk/MyLife_3.jpg,she was angry to dani and asking  what are you doing.
https://raw.githubusercontent.com/YunjungLeeHappy/AnnotationC/main/annotorious_github/assets/Tappytoon/Mturk/Dungeon_4.jpg,TWO PEOPLE AND ONE RABBIT ARE LOOK UNDER A TRAP. ONE  ANOTHER PERSON LOOK AROUND THE PLACE.
